{
 "circuitKey": "Austin",
 "closed": true,
 "coordinateSystem": "openf1-location",
 "derivation": {
  "direction": "increasing index = direction of travel",
  "lapsUsed": 9,
  "scale": {
   "assumedUnitMeters": 0.1,
   "impliedUnitMeters": 0.1019,
   "lengthErrorPct": -1.89,
   "status": "within-tolerance"
  },
  "sessionKeys": [
   9888
  ],
  "sigmaMeters": 6.0,
  "spikeVerdict": "PASS",
  "startFinishAtIndex0": true,
  "stepMeters": 2.0,
  "tool": "tools/openf1-spike",
  "zSource": "median observed z per vertex; unreliable where the line crosses itself"
 },
 "unitMeters": 0.1,
 "widthMeters": null,
 "points": [
  [-1071.7,-591.2,1302.0],
  [-1055.9,-603.4,1302.0],
  [-1040.0,-615.6,1302.0],
  [-1024.1,-627.8,1302.0],
  [-1008.2,-640.0,1302.0],
  [-992.3,-652.1,1302.0],
  [-976.5,-664.3,1302.0],
  [-960.6,-676.5,1302.0],
  [-944.7,-688.6,1302.0],
  [-928.8,-700.8,1302.0],
  [-912.9,-712.9,1302.0],
  [-897.0,-725.1,1302.0],
  [-881.1,-737.2,1302.0],
  [-865.2,-749.4,1302.0],
  [-849.3,-761.5,1302.0],
  [-833.4,-773.7,1302.0],
  [-817.5,-785.9,1302.0],
  [-801.6,-798.0,1302.0],
  [-785.7,-810.2,1302.0],
  [-769.8,-822.3,1302.0],
  [-753.9,-834.5,1302.0],
  [-738.0,-846.6,1302.0],
  [-722.1,-858.8,1302.0],
  [-706.2,-871.0,1302.0],
  [-690.3,-883.1,1302.0],
  [-674.4,-895.3,1302.0],
  [-658.6,-907.5,1303.0],
  [-642.7,-919.7,1302.0],
  [-626.8,-931.8,1302.0],
  [-610.9,-944.0,1302.0],
  [-595.0,-956.2,1302.0],
  [-579.2,-968.4,1302.0],
  [-563.3,-980.5,1302.0],
  [-547.4,-992.7,1302.0],
  [-531.5,-1004.9,1302.0],
  [-515.6,-1017.0,1302.0],
  [-499.7,-1029.2,1302.0],
  [-483.8,-1041.3,1302.0],
  [-467.9,-1053.5,1302.0],
  [-452.0,-1065.6,1302.0],
  [-436.1,-1077.7,1302.0],
  [-420.1,-1089.9,1302.0],
  [-404.2,-1102.0,1302.0],
  [-388.3,-1114.1,1302.0],
  [-372.4,-1126.3,1302.0],
  [-356.5,-1138.4,1302.0],
  [-340.6,-1150.6,1302.0],
  [-324.7,-1162.7,1302.0],
  [-308.8,-1174.9,1303.0],
  [-292.9,-1187.1,1303.0],
  [-277.1,-1199.3,1302.7],
  [-261.2,-1211.4,1302.3],
  [-245.3,-1223.6,1302.0],
  [-229.4,-1235.8,1302.8],
  [-213.5,-1248.0,1303.5],
  [-197.7,-1260.2,1305.0],
  [-181.8,-1272.3,1305.0],
  [-165.9,-1284.5,1305.0],
  [-150.0,-1296.7,1305.0],
  [-134.2,-1308.9,1305.0],
  [-118.3,-1321.1,1305.0],
  [-102.4,-1333.3,1304.7],
  [-86.6,-1345.5,1304.3],
  [-70.7,-1357.7,1304.0],
  [-54.8,-1369.9,1304.0],
  [-39.0,-1382.1,1304.0],
  [-23.1,-1394.3,1304.0],
  [-7.2,-1406.5,1304.0],
  [8.6,-1418.7,1304.0],
  [24.5,-1430.9,1304.0],
  [40.4,-1443.1,1304.0],
  [56.2,-1455.3,1304.0],
  [72.1,-1467.5,1304.0],
  [88.0,-1479.6,1304.0],
  [103.8,-1491.8,1304.0],
  [119.7,-1504.0,1304.0],
  [135.6,-1516.2,1304.0],
  [151.5,-1528.4,1303.0],
  [167.4,-1540.5,1303.0],
  [183.2,-1552.7,1303.0],
  [199.1,-1564.9,1303.0],
  [215.0,-1577.0,1303.0],
  [230.9,-1589.2,1303.0],
  [246.8,-1601.4,1303.0],
  [262.7,-1613.5,1303.0],
  [278.6,-1625.7,1303.0],
  [294.5,-1637.9,1303.0],
  [310.3,-1650.0,1303.0],
  [326.2,-1662.2,1303.0],
  [342.1,-1674.4,1303.0],
  [358.0,-1686.5,1303.0],
  [373.9,-1698.7,1303.0],
  [389.8,-1710.9,1302.0],
  [405.7,-1723.0,1303.0],
  [421.6,-1735.2,1302.0],
  [437.5,-1747.3,1303.0],
  [453.4,-1759.5,1303.0],
  [469.3,-1771.7,1303.0],
  [485.2,-1783.8,1303.0],
  [501.1,-1796.0,1302.0],
  [517.0,-1808.1,1302.0],
  [532.9,-1820.3,1302.0],
  [548.8,-1832.4,1302.0],
  [564.7,-1844.6,1302.0],
  [580.6,-1856.7,1302.0],
  [596.5,-1868.9,1302.0],
  [612.4,-1881.0,1302.0],
  [628.3,-1893.2,1302.0],
  [644.2,-1905.3,1302.0],
  [660.1,-1917.5,1302.0],
  [676.0,-1929.7,1302.0],
  [691.8,-1941.8,1302.0],
  [707.7,-1954.0,1302.0],
  [723.6,-1966.1,1302.0],
  [739.5,-1978.3,1302.0],
  [755.4,-1990.5,1302.0],
  [771.3,-2002.6,1302.0],
  [787.2,-2014.8,1302.0],
  [803.1,-2027.0,1302.0],
  [819.0,-2039.1,1302.0],
  [834.9,-2051.3,1302.0],
  [850.7,-2063.5,1302.0],
  [866.6,-2075.6,1302.0],
  [882.5,-2087.8,1302.0],
  [898.4,-2100.0,1302.0],
  [914.3,-2112.2,1302.5],
  [930.2,-2124.3,1303.0],
  [946.1,-2136.5,1303.0],
  [961.9,-2148.7,1303.0],
  [977.8,-2160.8,1303.0],
  [993.7,-2173.0,1303.0],
  [1009.6,-2185.2,1303.0],
  [1025.5,-2197.4,1303.0],
  [1041.4,-2209.5,1303.5],
  [1057.3,-2221.7,1304.0],
  [1073.2,-2233.8,1304.0],
  [1089.1,-2246.0,1304.0],
  [1105.0,-2258.2,1304.0],
  [1120.9,-2270.3,1305.0],
  [1136.8,-2282.5,1305.3],
  [1152.7,-2294.6,1305.7],
  [1168.6,-2306.7,1306.0],
  [1184.5,-2318.9,1307.0],
  [1200.4,-2331.0,1307.2],
  [1216.3,-2343.2,1307.4],
  [1232.2,-2355.3,1307.6],
  [1248.1,-2367.5,1307.8],
  [1264.0,-2379.6,1308.0],
  [1279.9,-2391.8,1309.0],
  [1295.8,-2403.9,1310.0],
  [1311.7,-2416.1,1310.0],
  [1327.6,-2428.3,1311.0],
  [1343.5,-2440.4,1311.5],
  [1359.4,-2452.6,1312.0],
  [1375.3,-2464.7,1313.0],
  [1391.2,-2476.9,1313.0],
  [1407.0,-2489.1,1314.0],
  [1422.9,-2501.2,1315.0],
  [1438.8,-2513.4,1315.5],
  [1454.7,-2525.6,1316.0],
  [1470.6,-2537.7,1317.0],
  [1486.5,-2549.9,1317.0],
  [1502.4,-2562.1,1318.0],
  [1518.3,-2574.2,1319.0],
  [1534.1,-2586.4,1320.0],
  [1550.0,-2598.5,1321.0],
  [1565.9,-2610.7,1322.3],
  [1581.8,-2622.9,1323.7],
  [1597.7,-2635.0,1325.0],
  [1613.6,-2647.2,1325.0],
  [1629.5,-2659.3,1325.0],
  [1645.4,-2671.5,1327.0],
  [1661.3,-2683.6,1327.5],
  [1677.2,-2695.8,1328.3],
  [1693.1,-2707.9,1329.2],
  [1709.0,-2720.1,1330.0],
  [1725.0,-2732.2,1332.0],
  [1740.9,-2744.4,1333.0],
  [1756.8,-2756.5,1334.0],
  [1772.7,-2768.7,1335.0],
  [1788.6,-2780.8,1336.0],
  [1804.5,-2793.0,1337.0],
  [1820.3,-2805.1,1339.0],
  [1836.2,-2817.3,1340.3],
  [1852.1,-2829.4,1341.7],
  [1868.0,-2841.6,1343.0],
  [1883.9,-2853.8,1344.0],
  [1899.8,-2865.9,1345.0],
  [1915.7,-2878.1,1346.0],
  [1931.6,-2890.2,1347.0],
  [1947.5,-2902.4,1348.5],
  [1963.4,-2914.6,1350.0],
  [1979.3,-2926.8,1351.5],
  [1995.1,-2938.9,1353.0],
  [2011.0,-2951.1,1354.0],
  [2026.9,-2963.3,1355.0],
  [2042.7,-2975.5,1357.0],
  [2058.6,-2987.7,1358.5],
  [2074.4,-3000.0,1360.0],
  [2090.3,-3012.2,1362.0],
  [2106.1,-3024.4,1363.3],
  [2121.9,-3036.7,1364.7],
  [2137.7,-3049.0,1366.0],
  [2153.5,-3061.2,1366.5],
  [2169.3,-3073.6,1370.0],
  [2185.1,-3085.9,1371.5],
  [2200.8,-3098.2,1373.0],
  [2216.6,-3110.6,1375.5],
  [2232.3,-3123.0,1378.0],
  [2248.0,-3135.3,1380.3],
  [2263.7,-3147.7,1382.7],
  [2279.5,-3160.1,1385.0],
  [2295.2,-3172.5,1386.0],
  [2310.9,-3184.8,1386.0],
  [2326.7,-3197.2,1389.5],
  [2342.4,-3209.5,1391.0],
  [2358.2,-3221.9,1393.5],
  [2373.9,-3234.2,1396.0],
  [2389.7,-3246.5,1397.5],
  [2405.5,-3258.8,1399.0],
  [2421.3,-3271.1,1401.2],
  [2437.1,-3283.3,1403.3],
  [2453.0,-3295.6,1405.5],
  [2468.8,-3307.8,1408.0],
  [2484.7,-3320.0,1411.0],
  [2500.5,-3332.2,1413.0],
  [2516.4,-3344.3,1414.5],
  [2532.3,-3356.5,1416.0],
  [2548.2,-3368.6,1418.0],
  [2564.2,-3380.8,1420.0],
  [2580.1,-3392.9,1422.0],
  [2596.0,-3405.0,1424.0],
  [2611.9,-3417.2,1427.0],
  [2627.8,-3429.3,1429.0],
  [2643.7,-3441.5,1430.7],
  [2659.6,-3453.7,1432.3],
  [2675.4,-3465.9,1434.0],
  [2691.3,-3478.1,1436.8],
  [2707.1,-3490.3,1439.5],
  [2722.9,-3502.6,1442.0],
  [2738.6,-3515.0,1444.0],
  [2754.4,-3527.3,1446.5],
  [2770.0,-3539.8,1449.0],
  [2785.7,-3552.2,1450.0],
  [2801.3,-3564.8,1455.0],
  [2816.9,-3577.3,1456.0],
  [2832.4,-3590.0,1457.0],
  [2847.9,-3602.6,1459.4],
  [2863.4,-3615.3,1461.8],
  [2878.8,-3628.0,1464.2],
  [2894.2,-3640.8,1466.6],
  [2909.6,-3653.6,1469.0],
  [2924.9,-3666.5,1471.5],
  [2940.2,-3679.3,1474.0],
  [2955.5,-3692.2,1476.0],
  [2970.8,-3705.1,1478.0],
  [2986.1,-3718.0,1480.8],
  [3001.4,-3730.9,1483.5],
  [3016.8,-3743.8,1489.0],
  [3032.1,-3756.6,1490.5],
  [3047.5,-3769.4,1493.3],
  [3062.9,-3782.2,1496.2],
  [3078.3,-3795.0,1499.0],
  [3093.7,-3807.8,1499.0],
  [3109.1,-3820.5,1505.0],
  [3124.6,-3833.2,1506.0],
  [3140.1,-3845.9,1509.0],
  [3155.6,-3858.5,1512.0],
  [3171.1,-3871.2,1515.5],
  [3186.6,-3883.8,1519.0],
  [3202.2,-3896.3,1522.0],
  [3217.9,-3908.8,1523.0],
  [3233.6,-3921.1,1527.5],
  [3249.4,-3933.4,1529.5],
  [3265.3,-3945.5,1531.0],
  [3281.4,-3957.3,1533.7],
  [3297.6,-3968.9,1536.3],
  [3314.1,-3980.1,1539.0],
  [3330.9,-3990.9,1543.0],
  [3347.9,-4001.1,1544.0],
  [3365.3,-4010.7,1547.0],
  [3383.0,-4019.6,1549.0],
  [3401.0,-4027.8,1550.0],
  [3419.4,-4035.3,1551.0],
  [3438.0,-4042.1,1554.0],
  [3456.9,-4048.2,1555.0],
  [3476.0,-4053.4,1557.0],
  [3495.3,-4057.8,1558.0],
  [3514.8,-4061.4,1558.0],
  [3534.3,-4064.0,1559.8],
  [3553.9,-4065.5,1561.5],
  [3573.5,-4066.0,1562.0],
  [3593.0,-4065.3,1562.5],
  [3612.3,-4063.3,1563.8],
  [3631.2,-4059.8,1565.0],
  [3649.7,-4054.7,1565.0],
  [3667.6,-4048.1,1565.5],
  [3684.8,-4039.9,1566.0],
  [3701.2,-4030.1,1566.0],
  [3716.7,-4018.9,1566.0],
  [3731.2,-4006.4,1566.0],
  [3744.6,-3992.6,1567.0],
  [3756.8,-3977.8,1568.0],
  [3767.7,-3962.0,1568.0],
  [3777.3,-3945.3,1568.0],
  [3785.6,-3927.9,1569.0],
  [3792.4,-3909.8,1569.0],
  [3797.9,-3891.3,1569.0],
  [3802.0,-3872.3,1569.0],
  [3804.9,-3853.0,1569.0],
  [3806.7,-3833.4,1569.0],
  [3807.6,-3813.7,1568.0],
  [3807.6,-3793.9,1568.0],
  [3807.0,-3774.0,1568.0],
  [3805.8,-3754.1,1567.0],
  [3804.2,-3734.2,1565.5],
  [3802.3,-3714.3,1565.0],
  [3800.1,-3694.4,1565.0],
  [3797.7,-3674.6,1564.0],
  [3795.0,-3654.8,1562.0],
  [3792.2,-3635.0,1561.0],
  [3789.2,-3615.2,1561.0],
  [3786.1,-3595.4,1558.0],
  [3782.7,-3575.7,1557.0],
  [3779.1,-3556.0,1556.0],
  [3775.3,-3536.4,1553.5],
  [3771.3,-3516.8,1552.0],
  [3767.1,-3497.3,1551.0],
  [3762.6,-3477.8,1547.0],
  [3757.8,-3458.4,1545.0],
  [3752.7,-3439.1,1544.0],
  [3747.2,-3419.9,1541.5],
  [3741.5,-3400.7,1540.0],
  [3735.4,-3381.7,1536.5],
  [3729.0,-3362.8,1533.0],
  [3722.3,-3344.0,1531.5],
  [3715.3,-3325.2,1530.0],
  [3708.0,-3306.6,1526.0],
  [3700.5,-3288.1,1523.0],
  [3692.7,-3269.7,1522.0],
  [3684.7,-3251.4,1518.0],
  [3676.6,-3233.1,1517.0],
  [3668.3,-3214.9,1513.0],
  [3660.0,-3196.7,1511.0],
  [3651.6,-3178.5,1508.0],
  [3643.2,-3160.4,1507.0],
  [3634.8,-3142.2,1502.0],
  [3626.3,-3124.1,1501.5],
  [3617.9,-3105.9,1498.0],
  [3609.5,-3087.8,1496.5],
  [3601.1,-3069.6,1495.0],